{"artifactRefs":[{"hash":"sha256:27616a61c8b69889b36af1bb51da0e45be0d2a6f6ff1d9d9f8411e1b6484626f","path":"conveyor/runs/2026/06/24/live-visual-proof-packet/artifacts/visual-proof-model.v1.json","role":"promoted_visual_model","status":"promoted"}],"authorityStatus":"promoted_authority","blockedIfMissing":["candidate_hardening_receipt_missing","promoted_visual_model_missing"],"claims":["Promoted visual model is the source truth for ASCII and HTML."],"completionPosture":"The promoted visual proof model is ready for projection.","consumedBy":{"actorKey":"contracts/projections/visual-proof.ascii-projection.v1.json","actorKind":"resolver_materializer"},"createdAt":"2026-06-24T00:00:00-04:00","deterministicVerificationRequired":true,"guardrails":{"deterministicReplayAllowedForCreation":false,"forbiddenHostFallback":true,"generatedCodeMayBeDurableTruth":false,"hostLanguageBodyAllowed":false,"mockAllowed":false,"sogPromotionRequired":true,"staleResponseAllowed":false},"lineage":{"claimRefs":["Hardening promotes one shared visual proof model."],"previousPacketRefs":["conveyor/runs/2026/06/24/live-visual-proof-packet/handoff-packets/01-cognitive-candidate.packet.v1.json"],"sourceRefs":[{"hash":"sha256:fb0c190dc62082294d4aaa4f1998d7e39fec7f7a307a561b834bc0af42bd9f23","path":"conveyor/runs/2026/06/24/live-visual-proof-packet/artifacts/candidate-visual-proof-model.v1.json","role":"candidate_visual_model","status":"candidate"}]},"packetKey":"defracto.handoff.live-visual-proof-packet.02-authority-hardening.v1","packetKind":"promoted_authority","producedBy":{"actorKey":"defracto.gates.visual_proof_candidate_hardening.v1","actorKind":"acceptance_gate"},"providerParticipationRequired":true,"requiredReceipts":[{"path":"conveyor/runs/2026/06/24/live-visual-proof-packet/receipts/candidate-hardening.receipt.v1.json","receiptKind":"candidate_hardening","requiredStatus":"passed"}],"runKey":"live-visual-proof-packet","schemaVersion":"defracto.conveyor-stage-handoff-packet.v1","stageKey":"visual-proof.authority-hardening","stageSequenceIndex":2}
